text ,date,game,seconds
good run then we have most Paul power,10/29/2019,14,275
plays and I thought both teams clogged,10/29/2019,14,275
it up real good I thought both teams,10/29/2019,14,275
made it hard it was hard to get the puck,10/29/2019,14,275
to Lynette I think partway through the,10/29/2019,14,275
game I looked up I thought there was,10/29/2019,14,275
like he was like each shots and stuff,10/29/2019,14,275
like that ORS not much going on but it,10/29/2019,14,275
was a competitive game we needed to win,10/29/2019,14,275
the game yeah find a way to win the game,10/29/2019,14,275
I thought we had got through when we got,10/29/2019,14,275
through the kill and then obviously we,10/29/2019,14,275
took another one there yeah on that high,10/29/2019,14,275
stick and it's unfortunate cuz I thought,10/29/2019,14,275
we'd done a real nice job in the PK he's,10/29/2019,14,275
not I mean he's injured but he's not,10/29/2019,14,275
really it's not his knee or nothing he's,10/29/2019,14,275
got a charley horse and so I don't know,10/29/2019,14,275
what that means though and I don't know,10/29/2019,14,275
timeline on that obviously you know what,10/29/2019,14,275
he's a good player for us important,10/29/2019,14,275
player for us but you know I thought all,10/29/2019,14,275
stepped up and played for a while Terry,10/29/2019,14,275
truth,10/29/2019,14,275
[Music],10/29/2019,14,275
well I don't know if he's wrong you know,10/29/2019,14,275
I think he would know he knows he lived,10/29/2019,14,275
it but I mean if you look at Steve,10/29/2019,14,275
Yzerman he lived it yeah a lot of guys,10/29/2019,14,275
love it they love it till they're 30 but,10/29/2019,14,275
you got to decide whether you want to,10/29/2019,14,275
wait till you're 30 or you want to,10/29/2019,14,275
figure it out now and it's the ultimate,10/29/2019,14,275
team game yeah and you gotta sacrifice,10/29/2019,14,275
individual rights for team rights and I,10/29/2019,14,275
say it all the time it's the two points,10/29/2019,14,275
in the game it has nothing to do with,10/29/2019,14,275
the points you get yourself but it's,10/29/2019,14,275
it's a process for a young guys and,10/29/2019,14,275
everybody in Toronto is in a rush all,10/29/2019,14,275
the time it you know I get it but that's,10/29/2019,14,275
not pro sport that's not real you got to,10/29/2019,14,275
keep building and building and building,10/29/2019,14,275
and steady on the rudder and keep going,10/29/2019,14,275
through things and matchups and learning,10/29/2019,14,275
to play with the lead and learning how,10/29/2019,14,275
to be patient and not turn the puck over,10/29/2019,14,275
and shift lengths and all the things,10/29/2019,14,275
that you're just a good player and you,10/29/2019,14,275
haven't had to deal with well you got to,10/29/2019,14,275
deal with the want to win in the,10/29/2019,14,275
National Hockey League and I mean look,10/29/2019,14,275
at the age of st. Louis you know well,10/29/2019,14,275
that's just the reality of the situation,10/29/2019,14,275
but the one thing about it is it gets,10/29/2019,14,275
your attention hurts your feelings,10/29/2019,14,275
probably a little bit,10/29/2019,14,275
well he knows he lived it he was the guy,10/29/2019,14,275
you know and then figured out this is,10/29/2019,14,275
what we got to do to win so you I mean,10/29/2019,14,275
that's why when he sees us you know we,10/29/2019,14,275
talked about this last year of fun to,10/29/2019,14,275
watch going 100 miles an hour gotta,10/29/2019,14,275
learn how to play right just just,10/29/2019,14,275
talking about running and gunning and,10/29/2019,14,275
not being able to play make the bottom,10/29/2019,14,275
line you got to keep it out of your net,10/29/2019,14,275
you're not out scoring anybody up,10/29/2019,14,275
playoff time you got out defend them and,10/29/2019,14,275
then it your skill comes to the,10/29/2019,14,275
forefront and and so that's what he's,10/29/2019,14,275
talking about and but is that not a fair,10/29/2019,14,275
assessment you know it hurts my feelings,10/29/2019,14,275
I could tell you that I'm the coach I'm,10/29/2019,14,275
supposed to get all this organized so,10/29/2019,14,275
but we know this we were working the,10/29/2019,14,275
words that everyday we're talking about,10/29/2019,14,275
it every single day just because you're,10/29/2019,14,275
talking about it it doesn't mean it's,10/29/2019,14,275
gonna change right away and sometimes,10/29/2019,14,275
it's just life lessons but in saying all,10/29/2019,14,275
that is we think we're on the right,10/29/2019,14,275
process we think we got good people and,10/29/2019,14,275
we're going in the right direction well,10/29/2019,14,275
you know what's played there in Plymouth,10/29/2019,14,275
and I saw him Lots as a junior when they,10/29/2019,14,275
first got him really NHL I thought of,10/29/2019,14,275
all the reqtest kid they got him here,10/29/2019,14,275
too soon and he's turned himself because,10/29/2019,14,275
he can play with good players he's a,10/29/2019,14,275
good talent he's mean he's heard he's,10/29/2019,14,275
physical he's a factor and but he can,10/29/2019,14,275
play in your top sex not many guys like,10/29/2019,14,275
that,10/29/2019,14,275
I thought we started really good I,11/1/2019,15,40
thought when we took the three penalties,11/1/2019,15,40
in a row we got off kilter and got on,11/1/2019,15,40
her heels and I didn't think we really,11/1/2019,15,40
did we lost with you got her game back,11/1/2019,15,40
yeah and so to me you got to play longer,11/1/2019,15,40
and harder than the other team and we,11/1/2019,15,40
were unable to do that we got ourselves,11/1/2019,15,40
a win and so we feel good about the win,11/1/2019,15,40
we're set up with a good week here this,11/1/2019,15,40
week we got to take some steps and the,11/1/2019,15,40
guys know that and I know that we had to,11/1/2019,15,40
do a better job was there was her best,11/1/2019,15,40
player right you know and so he was,11/1/2019,15,40
flying,11/1/2019,15,40
obviously he had some history here,11/1/2019,15,40
wanted to make an impression was good I,11/1/2019,15,40
mean we had him on multiple lines,11/1/2019,15,40
I thought he played well yeah I mean,11/1/2019,15,40
